Dealer Name,Address,City,State,Contact
MG Patna,"Ground Floor, Ashiana Vihar Apartment, Near CDA Building, Rajendra Path, , Patna, Bihar - 800001",Patna,Bihar,9608916710
MG Trivandrum,"KJ Square, TC -55/719/1,Kaimanam, Karmana  , Trivandrum, Kerala - 695040",Thiruvananthapuram,Kerala,8606910117
MG Raipur,"Ring Road No.1, Raipura  , Raipur, Chhattisgarh - 492099",Raipur,Chattisgarh,9111105025
MG Hubli,"Bellad Enterprises Pvt Ltd, Opp NGEF, Rayapur, PB Road, , Hubli, Karnataka - 580025",Dharwad,Karnataka,9632921143
MG Bangalore Kalyan Nagar,"Property bearing No.100/1 and bearing site No.3,Now come within the limites of BBMP Khata No.164 situated at Chikkathayappa Reddy layout, Bengaluru, Karnataka - 560043",Bangalore,Karnataka,9611600055
MG Chandigarh Tricity,"Business Block , Elante Mall -178, MW Area, Industrial Area Phase I, , Chandigarh, Chandigarh - 160002",Chandigarh,Chandigarh,7888799210
MG Jalandhar,"BSF Chowk, G.T. Road  , Jalandhar, Punjab - 144001",Jalandhar,Punjab,8264101200
MG Dehradun,"Saharanpur Road, Mahobewala Chowk  , Dehradun, Uttarakhand - 248002",Dehradun,Uttarakhand,9837888952
MG Calicut,"Opposite West Hill Post Office, Kannur Road , West Hill P.O , Calicut, Kerala - 673005",Kozhikode,Kerala,7902430000
MG Thrissur,"Near Palliakara Toll Plaza, NH-47, Menmankkiara Chitissery PO , Thrissur, Kerala - 680301",Thrissur,Kerala,7902420000
MG Ahmedabad Naroda,"GF-4, Neelkanth Square, Nr.Railway Crossing, NH8,Naroda,Ahmedabad, Ahmedabad, Gujarat - 382330",Ahmedabad,Gujarat,7229044555
MG Kanpur,"15/63, Rudra House, Civil Lines  , Kanpur, Uttar Pradesh - 208001",Kanpur Dehat,Uttar Pradesh,8795829725
MG Pune Bund Garden,"Parakh House, Boat Club(Liberty phase 2 Bund Garden, Sangamvadi) , Pune, Maharashtra - 411001",Pune,Maharashtra,9099058585
MG Chennai Anasalai,"NO. 824/2, ANNASALAI NANDANAM, Chennai, Tamil Nadu, , Chennai, Tamil Nadu - 600035",Chennai,Tamil Nadu,7733994433
MG Jodhpur,"Plot No - 18, Opp. Saras Dairy, Heavy Industrial Area , Jodhpur, Rajasthan - 342003",Jodhpur,Rajasthan,7230051525
MG Thane,"Shop no 16, Dosti Imperia, Ghodbunder Road, Thane West, Thane , Mumbai, Maharashtra - 400610",Thane,Maharashtra,2242436666
MG Hyderabad banjara Hills,"8-2-120/86/10,10A,11B,11C and 11D, Opp: Hotel Park Hyatt, Road Number 2, Banjara Hills, Hyderabad, Telangana - 500033",Hyderabad,Telangana,7288885566
MG Jammu,"Malik Market, Narwal Bypass  , Jammu, Jammu and Kashmir - 180016",Jammu,Jammu & Kashmir,9596780090
MG Mumbai West,"CTS 227,Service Road, Near Junction of JVLR & Western Express Highway, Gupha Tekdi,, Mumbai, Maharashtra - 400063",Mumbai,Maharashtra,7229051111
MG Vadodara,"Zorba, Akshara chowk, OP road  , Vadodara, Gujarat - 390012",Vadodara,Gujarat,6358800230
MG Agra,"404, Nagla Padi, Near Arvind Hyundai  , Agra, Uttar Pradesh - 282005",Agra,Uttar Pradesh,6396752741
MG Ranchi,"Near Firayalals Pulsar Plaza, Line Tank Rd  , Ranchi, Jharkhand - 834001",Ranchi,Jharkhand,6299423756
MG Navi Mumbai,"Old Mahindra Showroom, Next to AutoBahn VW Showroom, Nerul , Mumbai, Maharashtra - 400607",Thane,Maharashtra,2242436666
MG Mysore,"Plot No. 201/1&2, Hunsur Road  , Mysore, Karnataka - 570017",Mysore,Karnataka,8217319145
MG Varanasi,"Andhrapull, Chaukaghat  , Varanasi, Uttar Pradesh - 221002",Varanasi,Uttar Pradesh,8010091091
MG Banglore ORR,"Shree bhuvaneswari Vokkaligara Sangha, Survey no 102-1, B Narayanapura, ORR , Bengaluru, Karnataka - 560016",Bangalore,Karnataka,9611600055
MG Chennai OMR,"No 4, Perungudi Industrial Estate Perungudi,Old Mahabalipuram Road Chennai, Tamil Nadu, Chennai, Tamil Nadu - 600097",Kanchipuram,Tamil Nadu,7733994433
MG Patiala,"Rajpura - Patiala Rd, near Casba Resort, Bahadurgarh, , Patiala, Punjab - 147001",Patiala,Punjab,7888799207
MG Hyderabad Gachibowli,"7-56/19,Dargah Road,Radhe Nagar,GachiBowli, Rai Durg  , Hyderabad, Telangana - 500034",Hyderabad,Telangana,7288885566
MG Jaipur Ajmer road,"Near Bajaj capital, G-3, Anukampa Tower, Church road (M.I. Road), Gopalbari, , Jaipur, Rajasthan - 302001",Jaipur,Rajasthan,8448030040
MG Patparganj,"Plot no 24, Patparganj Industrial Area  , Delhi, Delhi - 110092",East Delhi,Delhi,9999514321
MG Rajkot,"Jai Ganesh MG. Opp Krishna Park, Rajkot-Gondal Highway,Kothariya, , Rajkot, Gujarat - 360003",Rajkot,Gujarat,7043910001
MG Lucknow Faizabad,"Milestone No.111, Faizabad Road, Chinhat  , Lucknow, Uttar Pradesh - 227105",Lucknow,Uttar Pradesh,9554962251
MG GWALIOR,"SURVEY NO. 51/7, SHIVPURI LINK ROAD, KEDARPUR , Gwalior, Madhya Pradesh - 474001",Gwalior,Madhya Pradesh,6232022801
MG Pune Wakad,"Survey no 142, Hissa no 1+2/5, Wakad, Mumbai Banglore highway , Pune, Maharashtra - 411057",Pune,Maharashtra,9099058585
MG Jamshedpur,"Usha More, Main Road, Tisco-Adityapur Housing Complex, Gamharia,, Jamshedpur, Jharkhand - 832108",Seraikela-kharsawan,Jharkhand,9905900241
MG Mumbai Malad,"Shakti Premises,Near Inorbit Mall, New Link Road,Ram Nagar,Malad (West) Opp.Cloud Nine Hospital,Mumbai, Mumbai, Maharashtra - 400064",Mumbai,Maharashtra,7229051111
MG Bhubaneswar,"Plot No. 86/88, Near Apex Institute of Technology & Management, Pahala, NH-16, Odisha, Bhubaneswar, Orissa - 752101",Khorda,Odisha,8144917572
MG Mohali,"Krishna Motor Garage, Plot no 3, Janta Industrial Estate Sector 82, SAS Nagar, Mohali, Punjab, Mohali, Punjab - 160082",Mohali,Punjab,7888799207
MG Vijaywada,"1-136/3, Gudavalli Junction,NH16, Rural Mandal  , Vijayawada, Andhra Pradesh - 521104",Krishna,Andhra Pradesh,9459594949
MG Cochin,"Opposite Metro Pillar no 155, NH 47, Muttom , Near Aluva , , Cochin, Kerala - 683106",Ernakulam,Kerala,7902410000
MG Vizag,"Tristar Auto,Behind Kali Mata Mandir, RK Beach Junction , Vizag, Andhra Pradesh - 530002",Visakhapatnam,Andhra Pradesh,7702384455
MG Mumbai South,"Cynergy IT Park,Near Maratha Udyog Bhavan, Appa Saheb Marathe Marg,Prabhadevi, , Mumbai, Maharashtra - 400025",Mumbai,Maharashtra,7229051111
MG Kolhapur,"S.No 592,H.No 4481 1st Stop MIDC Shiroli(P) Tal-Hatkanangale, Dist-Kolhapur , Kolhapur, Maharashtra - 416122",Kolhapur,Maharashtra,7620115015
MG Karnal,"Adjoining Sudhanshu ji Maharaj Ashram, Near Devi Lal Chowk , Karnal, Haryana - 132001",Karnal,Haryana,9606950161
MG Bangalore Chord Road,"Site Bearing No.84(old No.32) situated at 20th Main, II-Block, in Rajajinagar Extension,, Bengaluru, Karnataka - 560010",Bangalore,Karnataka,9611600055
MG GUWAHATI,"Royal Orchid, NH37, Near Garchuk Police station, Garchuk, Dhirenpara, Guwahati, Assam - 781035",Kamrup,Assam,7375006775
MG Lajpat Nagar,"A-14, Ring Road, Lajpat Nagar- IV  , Delhi, Delhi - 110024",South Delhi,Delhi,9953889889
MG Bhopal,"Near Shiv Mandir,Ahmedpur Kalan Hoshangabad Road Bhopal , Bhopal, Madhya Pradesh - 462026",Bhopal,Madhya Pradesh,8889655222
MG Surat,"Ground floor, Icon business centre, opposite central mall, Piplod Dumas Road , Surat, Gujarat - 395007",Surat,Gujarat,8511247711
MG Kolkata North,"EcoCentre Ambuja Neotia, EM Block, Sector V, Salt Lake City , Kolkata, West Bengal - 700091",North 24 Parganas,West Bengal,9674215000
MG Jaipur Tonk Road,"Plot No. 2& 3/4, Choudhary Charan Singh Colony, Tonk Road , Jaipur, Rajasthan - 302029",Jaipur,Rajasthan,8448030040
MG Coimbatore,"No-138, Avinashi Road, Chinniyampalayam, , Coimbatore, Tamil Nadu - 641062",Coimbatore,Tamil Nadu,9121388848
MG MADURAI,"Shed No. D-23, Nilaiyur First Bit, Uchapatti Village,Thirumangalam, Madurai, Tamil Nadu - 625008",Madurai,Tamil Nadu,7904968792
MG Ghaziabad,"Block G, Patel Nagar 3,  Patel Nagar, Ghaziabad,, Ghaziabad, Uttar Pradesh - 201003",Ghaziabad,Uttar Pradesh,9999514321
MG Nagpur,"33B 1/4 HINGHNA MIDC, OPP NANGIA SPECIALITY HOSPITAL, HINGHNA, Nagpur, Maharashtra - 440028",Nagpur,Maharashtra,9975560884
MG Faridabad,"14/6, Mathura Rd, Pocket B, Sector 27  , Faridabad, Haryana - 121003",Faridabad,Haryana,8929249127
MG Kolkata South,"97A Southern Avenue  , Kolkata, West Bengal - 700039",South 24 Parganas,West Bengal,9674215000
MG Goa,"Survey no.166/1, New Taleigao bypass road, Opp.Taleigao Community Centre.Taeiga , Goa, Goa - 403002",North Goa,Goa,9022901940
MG Ludhiana,"GT Road Jugiana, Adjoining indian oil petrol pump  , Ludhiana, Punjab - 141010",Ludhiana,Punjab,8872088288
MG Lucknow Hazratganj,"10, Ashok Marg,Opposite GST Bhawan, Hazratganj , Lucknow, Uttar Pradesh - 226001",Lucknow,Uttar Pradesh,7600058655
MG Banglore JP nagar,"BBMP New Municipal No.14, situated at 100 feet road, 4th phase J.P. Nagar, BBMP Khata bearing,, Bengaluru, Karnataka - 560078",Bangalore,Karnataka,9611600055
MG Aurangabad,"ABC Complex, Adalat Road, Chintamani Colony, , Aurangabad, Maharashtra - 431005",Aurangabad,Maharashtra,7720068855
MG Banglore Electronic City,"195/6/2, Ward no 192, Beratena Agrahara, Luv Kusha Nagar , Hosur road , Bengaluru, Karnataka - 560100",Bangalore,Karnataka,9611600055
MG Ahmedabad SG Highway,"Plot no 2,Ground Floor, Survey no 841/1 and 2,10 Signature 1,Near Old Railway Line,, Ahmedabad, Gujarat - 380051",Ahmedabad,Gujarat,7229044555
MG Indore,"1/2-Anoop Nagar,AB Road  , Indore, Madhya Pradesh - 452001",Indore,Madhya Pradesh,8889644222
MG Noida,"Sales: Gardens Galleria Mall Service: D-2 , Sector 8 , Noida, Uttar Pradesh - 201301",Gautam Buddha Nagar,Uttar Pradesh,7017248607
MG Bareilly,"4.5th Km Rampur Road, Maheshpura Atariya , Bareilly, Uttar Pradesh - 243001",Bareilly,Uttar Pradesh,9760985969
MG Delhi West Rohini,"A1/1, PRASHANT VIHAR  OUTER RING ROAD, Delhi, Delhi - 110085",North Delhi,Delhi,7428384888
MG  Delhi South Safdurjung,"A-2/5, Safdarjung Enclave  , Delhi, Delhi - 110029",South West Delhi,Delhi,9953889889
MG Delhi West Shivaji Marg,"Plot no 31, Najafgarh Road  Industrial Area Shivaji Marg, Delhi, Delhi - 110015",West Delhi,Delhi,7428384856
MG Gurgaon Flagship Showroom,"Sector 15 Part 2  , Gurugram, Haryana - 122022",Gurugram,Haryana,9711358888
MG Gurgaon Metropolis,"MGF Metropolis, Sector 28  , Gurugram, Haryana - 122001",Gurgaon,Haryana,9711358888
MG JABALPUR,"1142, opp. Bhasin arcade, axis bank, prem nagar, nagpur road, madan mahal, Jabalpur, Madhya Pradesh - 482002",Jabalpur,Madhya Pradesh,6262625100
MG Udaipur,"CP-6/CP-7, Madri Industrial Area  , Udaipur, Rajasthan - 313001",Udaipur,Rajasthan,8696234540
MG Nashik,"B-88 MIDC AMBAD, Mumbai Agra highway, Next to Hotel gateway, Nashik, Maharashtra - 422010",Nashik,Maharashtra,2536636666
