"Dealer Name","Address","City","State","Contact"
"Rio Nissan","Ground Floor, Lamba Line, Raksha Vihar, South Andaman - 744103","South Andaman","Andaman & Nicobar Islands","+918001192992"
"Hitech Nissan","No 9/121/1, 3rd Mile Stone, Reniguna Road, Chittoor - 517506","Chittoor","Andhra Pradesh","+919000454634"
"Kantipudi Nissan","S No 202/1A, NH 5, Gandhi Prakash Nagar, East Godavari - 533107","East Godavari","Andhra Pradesh","+919533799799"
"Express Nissan","No B143/3/144/1, Mangalagiri Road, Guntur - 522001","Guntur","Andhra Pradesh","+919121144855"
"Express Nissan","No 59A 1/1/1, KP Nagar, Vijayawada - 520008","Vijayawada","Andhra Pradesh","+919121144848"
"Nigla Nissan","2nd Mile, Pasighat, East Siang - 791102","East Siang","Arunachal Pradesh","+913602258111"
"Nigla Nissan","NH 52 A, Lekhi, Naharlagun, Naharlagun - 791110","Naharlagun","Arunachal Pradesh","+918657731151"
"Binod Nissan","Ground Floor, NH 31, Part 2, Chapaguri, Bongaigaon - 783380","Bongaigaon","Assam","+919706435318"
"SRB Nissan","Ground Floor, Normal School Road, Tarapur, Cachar - 788003","Cachar","Assam","+917506233826"
"Nova Nissan","Ground Floor, Pulibor, Jorhat - 785001","Jorhat","Assam","+917506238836"
"Binod Nissan","Sun City Complex, AT Road, Adabari, Kamrup - 781014","Kamrup","Assam","+918657731139"
"Binod Nissan","Ground Floor, NH 37, Detkuchi, Lalung Gaon, Kamrup - 781034","Kamrup","Assam","+917045690355"
"Dhaanvi Nissan","Ground Floor, AT Road, Senchowa, Nagaon - 782002","Nagaon","Assam","+917045690358"
"Dhaanvi Nissan","Ground Floor, Dekargaon, Baruahchuburi, Sonitpur - 784501","Sonitpur","Assam","+919435060613"
"Far East Nissan","NH 37, Banshbari, New development Area, Hijuguri, Tinsukia - 786125","Tinsukia","Assam","+917506236932"
"Goberdhan Nissan","Manjhari Nikunj, Aamgola, Muzaffarpur - 842001","Muzaffarpur","Bihar","+917506238695"
"Nutun Nissan","Khata No 352, Plot No 2129, New Bypass, Saristabad, Anisabad, Patna - 800002","Patna","Bihar","+917506238744"
"Urja Nissan","Ground Floor, Saguna More, Patna - 801503","Patna","Bihar","+917781016215"
"Joshi Nissan","Plot No 16, Phase 1, Industrial Area, Chandigarh - 160002","Chandigarh","Chandigarh","+911725305300"
"Shiva Nissan","Ground Floor, GE Road, Raipur - 492001","Raipur","Chhattisgarh","+917045690334"
"Pramukh Nissan","Survey No 15/1, Shade No1, Silvassa Bhaild Main Road, Silvassa - 396230","Silvassa","Dadra & Nagar Haveli","+919099937307"
"Sparsh Nissan","No 29, Shivaji Marg, Moti Nagar, New Delhi - 110015","New Delhi","Delhi","+919769643709"
"YOUWE Nissan","No F 1/9, Phase 1, Okhla Industrial Area, Okhla, New Delhi - 110020","New Delhi","Delhi","+919769548528"
"Zedex Nissan","Plot No 89, FIE, Patparganj Industrial Area, New Delhi - 110092","New Delhi","Delhi","+919769515646"
"AM Nissan","Plot Nos 49/3 & 49/4, NH 17, Salcete, South Goa - 403722","South Goa","Goa","+917045690340"
"Central Nissan","Ground Floor, Shivalikishan, Ambawadi, Ahmedabad - 380015","Ahmedabad","Gujarat","+917045690314"
"Pure Nissan","Sun Embark, GF, Vishwas City 1, SG Highway, Sola, Ahmedabad - 380054","Ahmedabad","Gujarat","+917045690317"
"Acuity Nissan","Ground Floor, NH 8, Navayard Chhani Rd, Anand Rojitra Rd, Anand - 388120","Anand","Gujarat","+912652772999"
"Rajarshi Nissan","No 6, Rajkot Road, Chandramani, Bhavnagar - 364004","Bhavnagar","Gujarat","+912786545151"
"IB Nissan","Plot No 79, GIDC, KPT Port, Sector 11, Gandhidham - 370201","Gandhidham","Gujarat","+919228001414"
"Sai Aarav Nissan","Ground Floor, Palanpur Bypass Junction, Highway Road, Mehsana - 382710","Mehsana","Gujarat","+917045690348"
"Pramukh Nissan","Ground Floor, NH 8, Grid Char Rasta, Kabilpore, Navsari - 396424","Navsari","Gujarat","+919825307771"
"IB Nissan","Ground Floor, NH 8B, Gondal Road, Vavdi, Rajkot - 360001","Rajkot","Gujarat","+918657731119"
"IB Nissan","NH 8B, Gondal Road, Vavdi, Rajkot - 360001","Rajkot","Gujarat","+919228001313"
"Pramukh Nissan","Cooperative Service Society, Block 22, Udhana Magdalla Rd, Khatodara, Surat - 394210","Surat","Gujarat","+919879500275"
"Pramukh Nissan","Ground Floor, Surat Dumas Road, Surat - 395007","Surat","Gujarat","+917045690318"
"Central Nissan","Plot No 49, Wadhwan Surendranagar Rd, Surendranagar, Surendranagar - 363030","Surendranagar","Gujarat","+919706435318"
"Aster Nissan","Plot No 986/32, Makarpura Main Road, GIDC, Vadodara - 390010","Vadodara","Gujarat","+919712348000"
"Acuity Nissan","H No 8, Navayard, Old Chhani Road, Vadodara - 390024","Vadodara","Gujarat","+917045690326"
"Pramukh Nissan","City Survey No 132, NH 8, GIDC, Valsad - 396191","Valsad","Gujarat","+917045690319"
"Velocity Nissan","NH 1, GT Road, Ambala - 134003","Ambala","Haryana","+918657588168"
"RPJ Nissan","Ground Floor, Sirsa Road, Fatehabad - 125050","Fatehabad","Haryana","+917045690664"
"Vertex Nissan","K No 1079/1013, Sohna Road, Sector 66, Gurgaon - 122018","Gurgaon","Haryana","+917506238682"
"Elina Nissan","NH 10, Delhi Hisar Bypass Road, 11 KM Stone, Hisar - 125001","Hisar","Haryana","+911662222333"
"Malwa Nissan","No 118/1, KM Stone, GT Road, Karnal - 132001","Karnal","Haryana","+919769989530"
"BA Nissan","Ground Floor, Sukhpura, Rohtak - 124001","Rohtak","Haryana","+919769631485"
"RPJ Nissan","Ground Floor, NH 9, Hissar Road, Sirsa - 125055","Sirsa","Haryana","+919769726907"
"M R Nissan","Ground & 1st Floor, Matour Chowk, Ghurkari, Kangra - 176001","Kangra","Himachal Pradesh","+919769934570"
"RC Nissan","Platinum Mall, NH 22, Anji, Solan - 173211","Solan","Himachal Pradesh","+919769847498"
"Shuhul Nissan","Ground Floor, National Highway, Sainik Colony, Jammu - 180010","Jammu","Jammu & Kashmir","+917506235815"
"Shuhul Nissan","Phase 2, Industrial Area, Gangyal, Jammu - 180010","Jammu","Jammu & Kashmir","+917045690626"
"HK Nissan","Plot No 221, NH 1A, Nowgam Bypass, Srinagar - 190018","Srinagar","Jammu & Kashmir","+918657731118"
"HK Nissan","National Highway, Bypass Crossing, Athwajan, Srinagar - 191101","Srinagar","Jammu & Kashmir","+918657731123"
"Animesh Nissan","Ground Floor, GT Road, Govindpur, Ratanpura, Dhanbad - 826004","Dhanbad","Jharkhand","+918657731153"
"Bhalotia Nissan","Ground Floor,7th Phase, Adityapur Industrial Area, Gamharia, Jamshedpur - 832109","Jamshedpur","Jharkhand","+918657731152"
"Titan Nissan","1st Floor, Main Road, Bagroy Market, Ranchi - 834001","Ranchi","Jharkhand","+917506233690"
"Titan Nissan","Ground Floor, NH 33, Ormanjhi, Chakla, Ranchi - 835219","Ranchi","Jharkhand","+917506238746"
"Surya Nissan","Sy No 9/1, Marathalli Ring Rd, Doddanekundi, KR Puram, Bengaluru - 560037","Bengaluru","Karnataka","+919606937956"
"Surya Nissan","No 8A, Hosur Main Road, Garvebhavipalya, Bengaluru - 560068","Bengaluru","Karnataka","+919845128333"
"Apple Nissan","No 810, 5th Block, 3rd Stage, 100 Ft Ring Rd, Hosakerahalli, Bengaluru - 560085","Bengaluru","Karnataka","+918026421777"
"Swasti Nissan","Ground Floor, Old PB Road, Nehru Nagar, Belgaum - 590016","Belgaum","Karnataka","+918095064900"
"Aarya Nissan","Sedam Road, Kusnoor, Gulbarga - 585102","Gulbarga","Karnataka","+918472225888"
"Honnassiri Nissan","No 193/5, Hunsur Main Road, Hinkel, Mysore - 570017","Mysore","Karnataka","+919900065530"
"EVM Nissan","Angels Plaza, TVS Junction, South Kalamaserry, Ernakulam - 682022","Ernakulam","Kerala","+919995809220"
"EVM Nissan","Building No XVI/139E, Intuc Jn, Maradu, Nettoor, Ernakulam - 682040","Ernakulam","Kerala","+919995066666"
"Swasti Nissan","Bellad Chamber 2, Uncal Cross, Vidya Nagar, Kottayam - 686016","Kottayam","Kerala","+918095700869"
"EVM Nissan","Ground Floor, MC Road, Thellakom, Ettumanoor, Kottayam - 686630","Kottayam","Kerala","+919567046666"
"EVM Nissan","Ground Floor, Pavangad, Puthiyangadi, Kozhikode - 673021","Kozhikode","Kerala","+919995046666"
"EVM Automobile Nissan","Bld No 3/837 B, Thirurkkad, Malappuram - 679321","Malappuram","Kerala","+919895200634"
"Pinnacle Nissan","Coimbatore Road, Kunnathurmedu, Palakkad - 678013","Palakkad","Kerala","+919048188888"
"EVM Nissan","Ground Floor, MC Rd, Nangelipady, Perumbavoor, Perumbavoor - 683541","Perumbavoor","Kerala","+918129066622"
"Marikar Nissan","Ground Floor, Chakkai Bypass, Venpalavattom, Anayara, Thiruvananthapuram - 695029","Thiruvananthapuram","Kerala","+919847869202"
"Pinnacle Nissan","Puzhakkalpadam, Guruvayur Road, Ayyanthole, Thrissur - 680003","Thrissur","Kerala","+918593800888"
"Pinnacle Nissan","Door No VPX 10/6740, Bypass Road, Mulluvila, Thrissur - 680014","Thrissur","Kerala","+918113000888"
"Pinnacle Nissan","Pinnacle Motor Works Pvt Ltd, NH 47, Mannuthy Byepass, Kuttanellur, Thrissur - 680014","Thrissur","Kerala","+918111885005"
"Shree Krishna Nissan","Nagpur Road, Sarra, Chhindwara - 480001","Chhindwara","Madhya Pradesh","+917162226165"
"Sumedha Nissan","Ground Floor, Shivpuri Link Road, Kedarpur, Gwalior - 474001","Gwalior","Madhya Pradesh","+917045690344"
"Shree Krishna Nissan","Rasuliya Road, New Hanuman Nagar, Rajeev Nagar, Hoshangabad - 461001","Hoshangabad","Madhya Pradesh","+918657588164"
"Anand Nissan","No 2/E/A, Scheme No 54, Brilliant Star, Vijay Nagar, MR 10 Road, Manorma Ganj, Indore - 452010","Indore","Madhya Pradesh","+917314715050"
"Platinum Nissan","Ground Floor, Andhua Bypass, NH 7, Jabalpur - 482002","Jabalpur","Madhya Pradesh","+917045690341"
"Galaxy Nissan","Ground Floor, Salakheri, Mhow Neemuch Road, Ratlam - 457001","Ratlam","Madhya Pradesh","+917045690351"
"Aztral Nissan","Shop No 9 to 14, 1st Floor, B Wing, Raja Bansilal Market, Aurangabad - 431001","Aurangabad","Maharashtra","+918657731116"
"Shriram Nissan","No E 55, MIDC, Kalamb Road, Latur - 413512","Latur","Maharashtra","+912382224499"
"ETCO Nissan","Ground Floor, Kamdhenu Realities, Sion Panvel Highway, Juhi Nagar, Mumbai - 400706","Mumbai","Maharashtra","+917045690265"
"Provincial Nissan","No G17/18, Central MIDC Road, MIDC Hingna, Nagpur - 440028","Nagpur","Maharashtra","+917447416232"
"Takekar Nissan","Shop No 3 & 4, Shreeji Sky Green Apt, New link Road, Tidke Colony Road, Nashik - 422007","Nashik","Maharashtra","+917263069009"
"ETCO Nissan","Plot No 41, Industrial Estate Ltd, Panvel, Panvel - 410206","Panvel","Maharashtra","+917045690275"
"Landmark Nissan","No 38/4, Krushna Complex, Shankar Nagar, Kharadi Hadapsar Bypass Rd, Kharadi, Pune - 411014","Pune","Maharashtra","+917045690285"
"Shriram Nissan","Plot No 24, Hotagi Road, Industrial Area, Solapur - 413003","Solapur","Maharashtra","+917350751111"
"Ritu Nissan","Ground Floor, Godbhunder Road, Vibgyor, Patlipada, Thane - 400607","Thane","Maharashtra","+919769806560"
"Iland Nissan","Ground Floor, Langhthabal Kunja, Canchipur, Imphal East - 795003","Imphal East","Manipur","+918657731149"
"Orange Nissan","Ground Floor, Park View, Lumsohphoh, East Khasi Hills - 793014","East Khasi Hills","Meghalaya","+917506238751"
"Rafael Nissan","Ground Floor, Chanmari, Aizawl - 796007","Aizawl","Mizoram","+917506237748"
"Nili Nissan","NH 29, Purana Bazar Road, Dimapur - 797117","Dimapur","Nagaland","+917045690321"
"Ananta Nissan","No 94, NH 5, Cuttack Highway, Pahal, Khorda - 752101","Khorda","Odisha","+918657731150"
"Bharat Nissan","Ground Floor, NH 6, Remed, Sambalpur - 768017","Sambalpur","Odisha","+917506235993"
"Vignesh Nissan","No 10A, East Coast Road, Paccamudaiyanpattu, Puducherry - 605001","Puducherry","Puducherry","+918489944191"
"Vignesh Nissan","No 1 to 7, Airport Road, Besant Nagar, Lawspet, Puducherry - 605008","Puducherry","Puducherry","+918489944191"
"Vignesh Nissan","No 10A, East Coast Rd, Pakkamudayanpet, Lawspet, Puducherry - 605008","Puducherry","Puducherry","+914132255191"
"M R Nissan","Plot No 11, GT Road, Mohan Vihar, Amritsar - 143001","Amritsar","Punjab","+919769967307"
"AVC Nissan","Mansa Road, Jassi Chowk, Bathinda - 151001","Bathinda","Punjab","+911642430243"
"Dada Nissan","Ground Floor, GT Road, Jalandhar - 144005","Jalandhar","Punjab","+919769830738"
"Dada Nissan","Ground Floor, Focal Point, GT Road, Ludhiana - 141014","Ludhiana","Punjab","+919769571621"
"Raj Nissan","No 387/10, Jaipur Road, Ajmer - 305001","Ajmer","Rajasthan","+917506235143"
"Raj Nissan","Ground Floor, Ajmer Road, Rico Area, Purani Chungi Naka, Ajmer - 305001","Ajmer","Rajasthan","+917045690671"
"Raj Nissan","Ajmer Road, Madanganj, Kishangarh, Ajmer - 305001","Ajmer","Rajasthan","+919414003015"
"Tirupati Nissan","Plot No 142, Alka Puri, Alwar - 301001","Alwar","Rajasthan","+919769546331"
"Saran Nissan","Ground Floor, NH 15, Jaisalmer Road, Bikaner - 334001","Bikaner","Rajasthan","+919413389103"
"Autofinnity Nissan","No C114, A & E, Road No 8, VKI Area, Jaipur - 302013","Jaipur","Rajasthan","+918657731120"
"Royal Nissan","No A 87, Prince Road, Vaishali Nagar, Jaipur - 302021","Jaipur","Rajasthan","+911414083756"
"Royal Nissan","Plot No 1 & 2, Tonk Road, Durga Vihar, Jaipur - 302029","Jaipur","Rajasthan","+911415142000"
"Bhaskar Nissan","Plot C6/7, Industrial Area, Jhunjhunu - 333001","Jhunjhunu","Rajasthan","+919929970411"
"Fatehpuria Nissan","Plot No G 13 & 14, Automobile Zone, Indraprastha Ind Area, Kota - 324005","Kota","Rajasthan","+917506234643"
"Raj Nissan","Ajmer Road, Moondwa Chouraha, Nagaur - 341001","Nagaur","Rajasthan","+911452634501"
"Bhaskar Nissan","Plot F 52 & 53, Industrial Area, Jaipur Road, Sikar - 332001","Sikar","Rajasthan","+919769628445"
"Autorelli Nissan","Old No 476, New No 672, Temple Towers, Anna Salai, Chennai - 600005","Chennai","Tamil Nadu","+917035898000"
"Lakshmi Nissan","Plot No 133, Velachery Main Road, Guindy, Chennai - 600032","Chennai","Tamil Nadu","+919551444423"
"Autorelli Nissan","No 2/574, Mount Poonamalle High Rd, Iyyapanthangal, Chennai - 600056","Chennai","Tamil Nadu","+917299987319"
"Lakshmi Nissan","No 67, 68 , Ambattur Industrial Est, Developers Plot, Ambattur, Chennai - 600058","Chennai","Tamil Nadu","+919941811150"
"Ramani Nissan","No 54/1, Mettupalayam Road, Kavundampalaym, Coimbatore - 641043","Coimbatore","Tamil Nadu","+919500470000"
"Ramani Nissan","No 304, Perundurai Main Road, Mel Tingal, Erode - 638011","Erode","Tamil Nadu","+919500470000"
"Marvel Nissan","No 237/3, Perandapalli, Bangalore Bypass Road, Nh 7, Krishnagiri, Hosur - 635109","Hosur","Tamil Nadu","+919095030786"
"Marvel Nissan","DN O2/104J, Agharam, Avathanapatti, Krishnagiri - 635101","Krishnagiri","Tamil Nadu","+914344322522"
"Jeevan Nissan","No 204, GST Road, Thanakkankulam, Madurai - 625006","Madurai","Tamil Nadu","+919442178870"
"PLA Nissan","Old No 7C, New No 20, Alexandria Road, Cantonment, Madurai - 625006","Madurai","Tamil Nadu","+919003393000"
"Win Nissan","No 77/1/B, Govt Medical College Road, Nagercoil - 629001","Nagercoil","Tamil Nadu","+918925175185"
"Ramani Nissan","No 46/42A, Perundurai Main Road, Nagercoil - 629001","Nagercoil","Tamil Nadu","+917045690633"
"Marvel Nissan","Ground Floor, Kandampatty Bypass Road, Salem - 636005","Salem","Tamil Nadu","+919791936665"
"Ahash Nissan","No 9, 14 & 16, Bypass Rd, PWD Ngr Extn, Melavasthachavady, Thanjavur - 613005","Thanjavur","Tamil Nadu","+917373775202"
"Jeevan Nissan","Cumbum Road, PC Patti, Theni, Theni - 625531","Theni","Tamil Nadu","+917397722895"
"Jeevan Nissan","No 27/35, Nagercoil Road, NH 7, Sengulam, Tirunelveli - 627151","Tirunelveli","Tamil Nadu","+919442178872"
"Ramani Nissan","No 647/1E, Winners Tower, Palladam Main Road, Tiruppur - 641604","Tiruppur","Tamil Nadu","+919500470000"
"Marvel Nissan","D No 81/2, Salem Road, Pon Nagar, Vellore - 632009","Vellore","Tamil Nadu","+919791936665"
"Jubilant Nissan","Survey No 374 & 375, New Vasoor, Alamelumangapuram, Vellore - 632009","Vellore","Tamil Nadu","+919677777241"
"Jeevan Nissan","Door No 366, Thiruthangal Road, Sivakasi, Virudhunagar - 626123","Virudhunagar","Tamil Nadu","+917397722895"
"Vibrant Nissan","No 160D, SP Road, Patny Nagar, Hyderabad - 500003","Hyderabad","Telangana","+919666914000"
"Vibrant Nissan","No 7/2/1830, Fatah Bagh, Erragadda, Hyderabad - 500018","Hyderabad","Telangana","+914023720000"
"Lakshmi Nissan","No 3/5/880, Narayanaguda, Himayat Nagar, Hyderabad - 500029","Hyderabad","Telangana","+918096666434"
"Lakshmi Nissan","No 3/5/880, Narayanaguda, Himayat Nagar, Hyderabad - 500029","Hyderabad","Telangana","+918096666434"
"Vibrant Nissan","Plot No 1 & 2, Lumbini Avenue, Gachibowli, Hyderabad - 500032","Hyderabad","Telangana","+919603614000"
"Lakshmi Nissan","Sy No 110/A, 111/1/AA, 112/1/E, Ward No 2, Block 4, Nagole Main Rd, Nagole, Hyderabad - 500068","Hyderabad","Telangana","+918096666377"
"Srikrishna Nissan","Plot No 4612 & 4615, Chinaihani, Airport Road, Usha Bazar, Agartala - 799009","Agartala","Tripura","+918657731128"
"Shiel Nissan","No 4, Prakash Enclave Bypass, Agra - 282005","Agra","Uttar Pradesh","+918657588162"
"Dee Nissan","No 4, Sardar Patel Marg, Civil Lines, Prayagraj - 211001","Prayagraj","Uttar Pradesh","+919769573445"
"Dee Nissan","1, Milling Compound, Lukerganj, Prayagraj - 211001","Prayagraj","Uttar Pradesh","+918657731121"
"Nath Nissan","Ground Floor, Rampur Road, Bidhaulia, Bareilly - 243502","Bareilly","Uttar Pradesh","+919769958240"
"Neo Nissan","No C 47, Meerut Road, Industrial Area, Ghaziabad - 201001","Ghaziabad","Uttar Pradesh","+919769621457"
"Pegasus Nissan","Ground Floor, NH 28, Nausarh, Gorakhpur - 273016","Gorakhpur","Uttar Pradesh","+919769827154"
"R N G Nissan","No 84/105A, Afim Kothi Crossing, GT Road, Kanpur Nagar - 208003","Kanpur Nagar","Uttar Pradesh","+919769847154"
"Dream Nissan","Ground Floor, Alambagh, Lucknow - 226005","Lucknow","Uttar Pradesh","+917506237747"
"Dream Nissan","VIN Palace, Tedhi Puliya, Ring Road, Sector 13 & 14, Lucknow - 226022","Lucknow","Uttar Pradesh","+917506237735"
"Dream Nissan","Ground Floor, Chinhat, Faizabad Road, Lucknow - 227105","Lucknow","Uttar Pradesh","+919769592394"
"Neo Nissan","Plot No C/26, Sector 3, Noida - 201301","Noida","Uttar Pradesh","+917045690599"
"Ganpati Nissan","No 542 K, Ganeshpur, Tarna, Shivpur, Varanasi - 221003","Varanasi","Uttar Pradesh","+919769874151"
"JKG Nissan","JKG Nissan Building, Haridwar Bypass Road, Dehradun - 248001","Dehradun","Uttarakhand","+919769942170"
"Pal Nissan","Plot No 88, Nainital, Rampur Road, Haldwani - 263139","Haldwani","Uttarakhand","+919769935750"
"JKG Nissan","No E/21, Bypass Road, Old Industrial Area, Haridwar - 249401","Haridwar","Uttarakhand","+911334656500"
"Dutta Nissan","Ground Floor, Old Court More, GT Road, Durgapur - 713213","Durgapur","West Bengal","+917506238850"
